<?xml version="1.0" encoding="UTF-8"?>
<emp xmlns:xsi="http://www.w3.org/2001/XMLSchema-instance" xsi:noNamespaceSchemaLocation="Section_4.xsd" >
	
	<employee>
		<refno>5000</refno>
		<refname>Praveen</refname>
		<address>Chennai</address>
		<phoneno>9897969594</phoneno>
		<degree>BE</degree>
		<empno>104</empno>		
	</employee>
	
	<employee>
		<refno>5001</refno>
		<refname>Anbazhagan</refname>
		<address>Bangalore</address>
		<phoneno>8989878767</phoneno>
		<degree>BSc</degree>
		<empno>106</empno>		
	</employee>
	
	<employee>
		<refno>5002</refno>
		<refname>Saravanan</refname>
		<address>Chennai</address>
		<phoneno>7876757878</phoneno>
		<degree>BE</degree>
		<empno>104</empno>		
	</employee>
	
	<employee>
		<refno>5003</refno>
		<refname>Rakesh</refname>
		<address>Pune</address>
		<phoneno>7788778877</phoneno>
		<degree>BSc</degree>
		<empno>105</empno>		
	</employee>
	
	<employee>
		<refno>5004</refno>
		<refname>Vikas</refname>
		<address>Mumbai</address>
		<phoneno>9844577866</phoneno>
		<degree>BE</degree>
		<empno>106</empno>		
	</employee>
	
	<employee>
		<refno>5005</refno>
		<refname>Sandeep</refname>
		<address>Pune</address>
		<phoneno>8867756643</phoneno>
		<degree>BSc</degree>
		<empno>102</empno>		
	</employee>
	
	<employee>
		<refno>5006</refno>
		<refname>Sumit</refname>
		<address>Bangalore</address>
		<phoneno>9897969594</phoneno>
		<degree>BE</degree>
		<empno>106</empno>		
	</employee>
	
	<employee>
		<refno>5007</refno>
		<refname>Rajesh</refname>
		<address>Mumbai</address>
		<phoneno>7654323456</phoneno>
		<degree>BSc</degree>
		<empno>104</empno>		
	</employee>
	
	<employee>
		<refno>5008</refno>
		<refname>Shalini</refname>
		<address>Chennai</address>
		<phoneno>9897969594</phoneno>
		<degree>BE</degree>
		<empno>105</empno>		
	</employee>

</emp>